S.no.	ID	Name	Email-id	Mobile no.	Address	City	State	Sector	Website
394	CG/2018/0211240	DIOCESE OF CHHATTISGARH CNI	skmartin10@gmail.com	9424147302	MISSION BOY HOSTEL MANDIR CHOWK BILASPUR	BILASPUR				
395	CG/2020/0256019	DISHA BAHUDESHIYA SEWA SAMITI	dishasamiti2019@gmail.com	9516345299	House No. 102, Vill. Mudwabhatha, Post. Chantipali, Tah. Sarangarh, Dist. Raigarh (C.G.) 496445	Sarangarh	CHHATTISGARH, 	Agriculture,Children,Education & Literacy,Environment & Forests,Health & Family Welfare,Labour & Employment,Micro Small & Medium Enterprises,Nutrition,Women's Development & Empowerment,		
396	CG/2016/0107444	Disha Education	preeti.khandelwal@dishamail.com	9893594042	Disha Crown, Katchna Road,Shankar Nagar,Raipur,Chhattisgarh, India,492007	Raipur	CHHATTISGARH, 	Vocational Training,	http://www.dishaeducation.org	
397	CG/2017/0170101	DISHA SAMAJ SEVI SANSTHA	dishacg@gmail.com	9406292239	VILLAGE-JAISAKARRA, POST- JAISAKARRA DIST KANKER CHHATTISGARH	CHARAMA	CHHATTISGARH, 	Agriculture,Art & Culture,Children,Dalit Upliftment,Environment & Forests,Human Rights,Labour & Employment,Land Resources,Micro Finance (SHGs),Nutrition,Panchayati Raj,Tribal Affairs,Women's Development & Empowerment,	http://www.dishacg.org/	
398	CG/2018/0210463	Disha Samiti Raigarh	dishasamiti@yahoo.com	8319523468	Chhittaranjan KutirNayapara Sonumuda Infront of Shavitri Nagar Colony Raigarh Chhattishgarh 496001	Raigarh				
399	CG/2018/0196231	district project livelihood college society dantewada	livelihoodcollege@gmail.com	7225836876	collector office	Dantewada	CHHATTISGARH, 	Agriculture,Animal Husbandry, Dairying  &  Fisheries,Education & Literacy,Aged/Elderly,Food Processing,Information & Communication Technology,Science & Technology,Vocational Training,Women's Development & Empowerment,	http://www.dantewada.gov.in/en/livelihood_college	
400	CG/2016/0103734	divine dream shiksha society durg	preetesh1992@gmail.com	8817109845	In front of polytechnic campus,near venkatesh bajaj durg  pin code-491001	durg		Education & Literacy,Vocational Training,		
401	CG/2018/0199029	Divya Sanskar Sikshan Seva Sansthan	drsunilsahu2@gmail.com	9300646659	SEEMA SADAN BORSI	DURG	CHHATTISGARH, 	Agriculture,Disaster Management,Education & Literacy,Environment & Forests,Health & Family Welfare,Nutrition,Rural Development & Poverty Alleviation,Water Resources,Women's Development & Empowerment,		
402	CG/2019/0243125	Divyang Wheelchair Cricket Federation of Chhattisgarh	divyangwheelchaircricket@gmail.com	8770587311	S/O RAJKUMAR NAVRANGE KENVRADIH, KANKI, TILDA, RAIPUR, CHHATTISGARH	Raipur	CHHATTISGARH, 	Sports,		
403	CG/2018/0222370	Don Bosco Youth Centre Jokbahla	dbycjokbahla@rediffmail.com	9174909887	Don Bosco Youth Centre Jokbahla P.O. Jokbahla	Kunkuri	CHHATTISGARH, 	Education & Literacy,		
404	CG/2020/0258623	DR SMRITI SHIKSHAN SAMITI AND SEWA SANSTHA	bjmpsd@gmail.com	9755141458	VILL PO DONGARI TEH BALODA DIST JANJGIR CHAMPA (CHHATTISGARH)	BALODA	CHHATTISGARH, 	Education & Literacy,Education & Literacy,Education & Literacy,Education & Literacy,		
405	CG/2019/0240585	Dr. Ramlakhan Gupta Foundation	ramfoundation07@gmail.com	9806003103	Agrasen Chowk, Station Road,Tahsil Durg, Dist Durg	Durg				
406	CG/2018/0201474	DREAM BASTAR TRANSFORMATION SOCIETY	santoshmaliful@gmail.com	8770548005	JAMES MILTON GALI, SHANTI NAGAR, FREZERPUR, JAGDALPUR. DIST. BASTAR, STATE. CHHATTISGARH-494001	Jagdalpur	CHHATTISGARH, 	Education & Literacy,Agriculture,Animal Husbandry, Dairying  &  Fisheries,Children,Drinking Water,Health & Family Welfare,Nutrition,Vocational Training,Women's Development & Empowerment,Youth Affairs,		
407	CG/2019/0236697	DREAM DUNIYA SOCIETY	nimeshsamuel111@gmail.com	8889809111	Roy Plaza ,Infront of SBR Collage ,Raipur Road Bilaspur Chhattisgarh	Bilaspur	CHHATTISGARH, 	Education & Literacy,Health & Family Welfare,HIV/AIDS,Information & Communication Technology,Labour & Employment,Panchayati Raj,Tribal Affairs,Vocational Training,Women's Development & Empowerment,		
408	CG/2019/0239333	Drishti Foundation	drishtifoundationraipur@gmail.com	9826828005	Office of Drishti Foundation, EAC Colony, Behind Collectorate, Raipur	Raipur	CHHATTISGARH, 	Children,Differently Abled,Education & Literacy,Aged/Elderly,Environment & Forests,Health & Family Welfare,HIV/AIDS,Information & Communication Technology,Nutrition,Science & Technology,Urban Development & Poverty Alleviation,Vocational Training,Women's Development & Empowerment,	http://drishtifoundation.org.in/	
409	CG/2020/0258871	Drona Shikshan Samiti	Dronakids@gmail.com	9425535514	Ashok Panday H.No-110, Jabda Para Marg, Sarkanda, Bilaspur Chhattisgarh-495001	Bilaspur	CHHATTISGARH, 	Education & Literacy,Health & Family Welfare,Rural Development & Poverty Alleviation,Urban Development & Poverty Alleviation,Women's Development & Empowerment,		
410	CG/2019/0234472	DRONACHARYA EDUCATION SOCIETY	deskorba@gmail.com	9826096097	NEAR JHUNJHUNWALA BUILDING, DARRI ROAD,	KORBA				
411	CG/2017/0164311	DURG EDUCATION & CHARITABLE SOCIETY	nalin2000@yahoo.com	9827191100	HIG-110,PADMANABHPUR, Durg, chhattisgarh, 491001	DURG	CHHATTISGARH, 	Education & Literacy,Food Processing,Health & Family Welfare,Information & Communication Technology,New & Renewable Energy,Science & Technology,Scientific & Industrial Research,Vocational Training,		
412	CG/2018/0213411	DURG JILA KANNOJIYA SWARNKAR SAMAJ,DURG	sjaindfs@gmail.com	9893149497	HOUSE NO 328 WARD NO 33SHIVAPARA BEHIND SHIV MANDIR, DURGCHHATISGARH	DURG				
413	CG/2019/0227075	DURG RAJASTHAN GAUDA BRAHMAN SAMAJ	ajaysharma.as1090@gmail.com	7587099565	GANJPARA DURG DIST DURG	Durg	CHHATTISGARH, 	Any Other,		
414	CG/2019/0234461	DURG SHRI BAGESWAR KASODAN VESAY SAMAJ DURG	anil.guptaji68@gmail.com	9770492571	h no 651 gayanagar dhanraj kirana gali post and tah jila durg	durg	CHHATTISGARH, 	Any Other,		
415	CG/2019/0237304	DURGA MAHILA MANDAL	durgamahilamandalnpr@gmail.com	9407617191	JAGDISH MANDIR WARD, WARD NO 9 NARAYANPUR	NARAYANPUR				
416	CG/2020/0251054	Durgasewashram jamdi,	Rajaramkushwaha339@gmail.com	9009485010	vall -jamdi,post- darripara, block-bhaiyathan,	Surajpur	CHHATTISGARH, 	Education & Literacy,Education & Literacy,		
417	CG/2018/0221060	EBENEZER GOSPEL COMMUNITY	shajilyssy146@gmail.com	9406293817	LIG-33, Bodhghat Housing Colony,Jagdalpur	Jagdalpur	CHHATTISGARH, 	Education & Literacy,Health & Family Welfare,Rural Development & Poverty Alleviation,Vocational Training,Any Other,		
418	CG/2020/0264406	ECOACT FOUNDATION	ecoactfoundation@gmail.com	7999640316	LIG-91 Pt. Ravishankar Shukla Nagar	korba	CHHATTISGARH, 	Agriculture,Animal Husbandry, Dairying  &  Fisheries,Children,Civic Issues,Differently Abled,Drinking Water,Environment & Forests,Health & Family Welfare,Legal Awareness & Aid,Micro Finance (SHGs),New & Renewable Energy,Right to Information & Advocacy,Rural Development & Poverty Alleviation,Vocational Training,Women's Development & Empowerment,		
419	CG/2020/0250861	EDIFY FOUNDATION	PJ_ITR@YAHOO.COM	7000541155	GROUND FLOOR, ISHANYA SOLITAIRE, JUNWANI ROAD, KOHKA	BHILAI	CHHATTISGARH, 	Education & Literacy,		
420	CG/2019/0235311	EK AASH JANKALYAN SANSTHA	ekaasa.chhattisgarh@gmail.com	9009239009	Village near Kanakpur 10th Battalion, Silifili Tahsil Surajpur District Surajpur Chhattisgarh	Surajpur	CHHATTISGARH, 	Agriculture,Animal Husbandry, Dairying  &  Fisheries,Art & Culture,Children,Civic Issues,Dalit Upliftment,Differently Abled,Disaster Management,Drinking Water,Education & Literacy,Aged/Elderly,Environment & Forests,Health & Family Welfare,HIV/AIDS,Information & Communication Technology,Labour & Employment,Legal Awareness & Aid,Rural Development & Poverty Alleviation,Tribal Affairs,Urban Development & Poverty Alleviation,Vocational Training,Water Resources,Women's Development & Empowerment,Youth Affairs,		
421	CG/2021/0273554	Ek Pehal Jankalyan Bahudeshiya Samajik Sanstha	socialsocietyekpahal@gmail.com	9993141737	Panchpedi Chowk, Raipur	Raipur	CHHATTISGARH, 	Health & Family Welfare,Women's Development & Empowerment,		
422	CG/2017/0172926	EKLAVYA HANDICAP WELFARE SOCIETY	dalbhatkendra@gmail.com	7389418344	NAVEEN ZILA CHIKITSAALAY PARISAR NUTAN CHOWK SARAKANDA	BILASPUR				
423	CG/2017/0178806	EKLAVYA JAN KALYAN SAMITI	tikeshwar.yaadav@gmail.com	9329120222	MAGNETIC DIGITAL MULTIMEDIA COMPUTER INSTITUTE , BEHIND BIRENDRA PRABHA HOTEL BABU PARA AMBIKAPUR	AMBIKAPUR	CHHATTISGARH, 	Biotechnology,Children,Education & Literacy,Information & Communication Technology,Labour & Employment,Vocational Training,	http://www.ancoax.com/	
424	CG/2018/0187780	ENTREPRENEUR EDUCATIONAL SOCIAL WELFARE FOUNDATION	biju@heavygroups.com	9827906950	355, SUBASH NAGAR NANDANI ROAD NEAR GOVT SCHOOL BHILAI 490011	BHILAI	CHHATTISGARH, 	Education & Literacy,Food Processing,Micro Finance (SHGs),	http://www.heavygroups.com/	
425	CG/2018/0202134	eqra modern education society	aarifsohail267@gmail.com	8770220923	WARD NO 03JAILPARA RAMANUJGANJ POPSRAMANUJGANJ DIST:-BALRAMPUR_RAMANUJGANJ PIN497220 CONTACT NO 62637486108770220923 97131657579617758892	RAMANUJGANJ	CHHATTISGARH, 	Art & Culture,Children,Education & Literacy,Information & Communication Technology,Minority Issues,Right to Information & Advocacy,Science & Technology,Sports,Vocational Training,Women's Development & Empowerment,		
426	CG/2017/0166094	FASTTAKE COMPUTER WELFARE AND EDUCATIONAL SOCIETY	fasttakeraigarh@gmail.com	8109894294	101 Kalindi Kunj Kabir Chowk Raigarh	Raigarh	CHHATTISGARH, 	Agriculture,Art & Culture,Biotechnology,Children,Differently Abled,Disaster Management,Drinking Water,Education & Literacy,Aged/Elderly,Environment & Forests,Health & Family Welfare,HIV/AIDS,Information & Communication Technology,Labour & Employment,New & Renewable Energy,Panchayati Raj,Right to Information & Advocacy,Rural Development & Poverty Alleviation,Science & Technology,Sports,Urban Development & Poverty Alleviation,Vocational Training,Women's Development & Empowerment,		
427	CG/2015/0091408	feel good mahila uthan society	feelgud007@gmail.com	9977911779	A/51 Bajaj Coloney Near gurkul school Rajendra Nagar raipur	raipur				
428	CG/2018/0221281	Feel Parmartham Foundation	feelparmartham@gmail.com	7000487419	First floor 61/4A, Matri Kunj, Bhilai	Bhilai	CHHATTISGARH, 	Aged/Elderly,Human Rights,Nutrition,Any Other,	http://www.feelparmartham.org	
429	CG/2017/0180799	Florence Institute of Medical Science	fioms.darpan@gmail.com	9300104100	31,COMMERCIAL COMPLEX, M. L. NEHRU NAGAR (EAST), BHILAI 490020	Bhilai	CHHATTISGARH, 	Education & Literacy,Health & Family Welfare,		
430	CG/2018/0190469	FORTUNE FOUNDATION	fortunefcg@gmail.com	9977335321	VILLAGE- PRETANDIH POST-KENDUDHAR BLOCK -SARAIPALI DISTT-MAHASAMUND PINCODE 493885	MAHASAMUND				
431	CG/2017/0151980	FRIENDS HELP GROUPS AND WELFARE SOCIETY	fhgwscg@outlook.com	9755522777	38/8 Nehru Nagar (w) Street No.- 12 Behind PNB	BHILAI	CHHATTISGARH, ANDAMAN &amp; NICOBAR ISLANDS, ANDHRA PRADESH, ARUNACHAL PRADESH, ASSAM, BIHAR, CHANDIGARH, DADRA & NAGAR HAVELI, DAMAN & DIU, DELHI, 	Agriculture,Animal Husbandry, Dairying  &  Fisheries,Children,Drinking Water,Education & Literacy,Food Processing,Health & Family Welfare,Information & Communication Technology,Labour & Employment,Legal Awareness & Aid,Micro Finance (SHGs),New & Renewable Energy,Panchayati Raj,Rural Development & Poverty Alleviation,Tribal Affairs,Urban Development & Poverty Alleviation,Vocational Training,Water Resources,Women's Development & Empowerment,Youth Affairs,Any Other,	http://www.fhgws.in	
432	CG/2017/0118840	FS Management India Private Limited	info@fsinida.in	9826132972	FS HOUSE, MARUTI VIHAR, MAHOBA BAZAR, GE ROAD, RAIPUR, CHHATTISGARH, PIN 492001	RAIPUR	CHHATTISGARH, 	Education & Literacy,Information & Communication Technology,Labour & Employment,Rural Development & Poverty Alleviation,Science & Technology,Vocational Training,Women's Development & Empowerment,Youth Affairs,	http://www.myaglakadam.com	
433	CG/2017/0114612	GAJANAN SHIKSHA SAMITI	aitm2007@rediffmail.com	9303336034	GRAM - TORANKATA , POST - SOMANI , G.E ROAD , RAJNANDGAON , CHHATTISGARH , PIN - 491441	RAJNANDGAON	CHHATTISGARH, 	Education & Literacy,	http://www.aitmrjn.in	
434	CG/2017/0178808	GANDAI SIDDI VIYANK EDUCATION SOCIETY	geemashrivas@gmail.com	8103029300	SMT GEEMA TONDRE WARD NO 07 PANDRIYA ROAD GANDAI TAH SIL CHHUIKHADAN DISTRICT RAJNANDGAON CHHATTISGARH 491888	GANDAI	CHHATTISGARH, 	Education & Literacy,Information & Communication Technology,Science & Technology,Vocational Training,		
435	CG/2020/0262608	GANGA SHIKSHA PRASARAK SAMITI	pawanchandrakar68@gmail.com	9752003546	GRAM- VA PO- BHATA GAON ( B)	BALOD	CHHATTISGARH, 	Education & Literacy,Health & Family Welfare,		
436	CG/2016/0113786	GANGA SHIKSHAN EVAM SAMAJ KALYAN SAMITI	mahabir267@gmail.com	8770775547	SARKANDA BILASPUR ,PIN CODE 495001	BILASPUR	CHHATTISGARH, 	Vocational Training,		
437	CG/2019/0248512	Garvit foundation chhattisgarh	garvitfoundation2018@gmail.com	9669959838	Shree pushpendra gajendra, 2nd floor D-89 sec. 05, devendra nagar, Raipur (CG) Pin No. 492004	Raipur	CHHATTISGARH, 	Children,Agriculture,Dalit Upliftment,Education & Literacy,Information & Communication Technology,Micro Small & Medium Enterprises,Nutrition,Women's Development & Empowerment,		
438	CG/2018/0218561	GAS MEMORIAL CENTRE	jayatavares2015@gmail.com	9425206050	Post Box No 16 JaistambhChowk K K Road Raipur C.G.	Raipur	CHHATTISGARH, 	Vocational Training,Women's Development & Empowerment,		
439	CG/2017/0161209	Gatiman Yuva Jan Chetana Samiti Rojhandih	mahendrapatley@gmail.com	7773807544	President Mahendra Patley Near by west Railway cabin Bhatapara ( Naila) Distt Janjgir champa c.g 495668	Naila	CHHATTISGARH, 	Agriculture,Children,Drinking Water,Education & Literacy,Legal Awareness & Aid,Panchayati Raj,Women's Development & Empowerment,		
440	CG/2018/0206252	GAUMUKHI SEWA DHAM	gopal.kba@gmail.com	7000670863	GAUMUKHI SEWADHAM Village-DEOPAHARI (Dist-KORBA) C/o Dr BANNERJEE CLINIC PREMISES TRANSPORT NAGAR, KORBA	KORBA	CHHATTISGARH, 	Tribal Affairs,Education & Literacy,Health & Family Welfare,Rural Development & Poverty Alleviation,	http://www.goumukhi.com	
441	CG/2019/0227561	GAURANSH COMPUTER AND SKILL DEVELOPMENT ACADEMY BALOD	tarun_tuwani@rediffmail.com	9993940008	C/o KAMAL KISHOR TUWANI, NEAR HIGH SCHOOL GROUND, WORD NO. 10, JAWAHAR MARKET BALOD. DISTBALOD (C.G.) PIN491226	BALOD	CHHATTISGARH, 	Art & Culture,Children,Differently Abled,Education & Literacy,Health & Family Welfare,Information & Communication Technology,Micro Small & Medium Enterprises,Minority Issues,Rural Development & Poverty Alleviation,Science & Technology,Sports,Tribal Affairs,Urban Development & Poverty Alleviation,Vocational Training,Women's Development & Empowerment,Youth Affairs,		
442	CG/2020/0252744	GAURISHANKAR SHIKSHA VIKASH SAMITI	gaurishankarnishad23@gmail.com	9770570074	MU.PO SEORINARAYAN SETHI NAGAR VARD 14 JANJGEER CHAMPA C.G	SEORINARAYAN	CHHATTISGARH, 	Education & Literacy,		
443	CG/2018/0207588	GAYATRI ANNAPURNA MAHILA SHWA SAHAYATA SAMUH	GAYATRIMEDICALSTORS@GMAIL.COM	8817011770	BARAMKELA DIST-RAIGARH C.G.	BARAMKELA	CHHATTISGARH, 	Food Processing,Food Processing,Any Other,Any Other,	https://ngodarpan.gov.in/index.php/ngo/primaryngo	
444	CG/2019/0246624	GAYATRI GRAMOTHAN SEWA SAMITI	ggssamiti@gmail.com	9407015591	GAYATRI PARIWAR STSANG BHAWAN RAGHAV MANDAIR KIRANDUL	KIRANDUL	CHHATTISGARH, 	Education & Literacy,		
445	CG/2018/0192399	GAYATRI PARIVAR SAMITI CHILHATI	pariwargayatri573@gmail.com	8959071361	Chilhati Post Office Loharshi Son Tehsil Masturi District Bilaspur Chhattisgarh	CHILHATI	CHHATTISGARH, 	Education & Literacy,		
446	CG/2016/0112798	GDR Educational Society Rungta Skills Academy	sonal@rungta.ac.in	9229155544	Rungta R1 Educational Campus, Kohaka Road, Kurud, Bhilai - 490024	Bhilai	CHHATTISGARH, 	Education & Literacy,Information & Communication Technology,New & Renewable Energy,Scientific & Industrial Research,Science & Technology,Vocational Training,Agriculture,Biotechnology,Food Processing,Sports,Tourism,Youth Affairs,	http://rungta.ac.in	
447	CG/2017/0176029	GEM LEARNING SERVICES PVT LTD	biswajit.chattaraj@nibf.in	7771009640	Gem Knowledge Park, NH30, Dhamtari Road, Mana, Raipur Chhattisgarh, INDIA492001	Raipur			http://nibf.in/	
448	CG/2019/0235188	genius education asd socialwelfare society	geniuswelfaresociety@gmail.com	9827875081	Near GarIma Press Tilak Nagar Bilaspur C.G.	BILASPUR	CHHATTISGARH, 	Any Other,		
449	CG/2019/0242807	GETHSAMANI AASHISH SEVA SAMITI	npbanjare346@gmail.com	9425583030	Sarai Dafai, New Ledari, Post- South Jhagrakhand, Tehsil- Manendragarh	SOUTH JHAGRAKHAND	CHHATTISGARH, 	Art & Culture,Children,Dalit Upliftment,Disaster Management,Education & Literacy,Environment & Forests,Health & Family Welfare,Tribal Affairs,Women's Development & Empowerment,		
450	CG/2017/0158875	GHANSHYAM DAS RUNGTA FOUNDATION	info@rungta.ac.in	9425236923	Rungta Educational Campus, Veer Sawarkar Nagar, Atari, Raipur	Raipur	CHHATTISGARH, 	Agriculture,Biotechnology,Education & Literacy,Food Processing,Information & Communication Technology,New & Renewable Energy,Science & Technology,Scientific & Industrial Research,Sports,Tourism,Vocational Training,Youth Affairs,	http://www.rungta.ac.in	
451	CG/2017/0159719	GHARIB NAWAZ EDUCATION SOCIETY	mjshona22@gmail.com	9644440085	GHARIB NAWAZ SCHOOL, BAIJNATHPARA	RAIPUR	CHHATTISGARH, 	Education & Literacy,	http://nawazsociety.org/	
452	CG/2019/0235659	GHYAN JYOTI EDUCATION SOCIETY	rewasahu86@gmail.com	8839722267	Village-Tipani ,Post-Rampurtch-Kurud Dist-Dhamtari	Dhamtari 	CHHATTISGARH, 	Drinking Water,Health & Family Welfare,Information & Communication Technology,Panchayati Raj,Rural Development & Poverty Alleviation,Tribal Affairs,Vocational Training,Women's Development & Empowerment,Youth Affairs,		
453	CG/2019/0223579	GITANJALI SANGEET SHIKSHAN SAMITI	gitanjalisangeetshikshansamiti@gmail.com	9229698371	INFRONT OF PRAIMARY SCHOOL NEAR OF SAI MANDIR KASARIDIH DURG	DURG	CHHATTISGARH, 	Education & Literacy,		
454	CG/2018/0210995	GLOBAL FOUNDATION & WELFARE SOCIETY SENDURAS	msahu170@gmail.com	9691519995	VPO SENDURAS THANA SARSIWA BLOCK BILAIGARH DISTT BALODABAZAR PIN 493559 C.G	BILAIGARH	CHHATTISGARH, 	Health & Family Welfare,Information & Communication Technology,Panchayati Raj,Rural Development & Poverty Alleviation,Vocational Training,Women's Development & Empowerment,Differently Abled,		
455	CG/2018/0210942	GLOBAL INSTITUTE OF EDUCATION TRAINING & DEVELOPMENT	globaloffice06@gmail.com	9669927577	Chandi Road Ward No 12, Tendulotha, Bagbahara, Mahasamund, Chhattisgarh, - 493449	Bagbahara	CHHATTISGARH, 	Vocational Training,		
456	CG/2018/0188444	global trust	vksept9590@gmail.com	7049912155	H. NO. 29/37 NEAR CANAL, RAJA TALAB, RAIPUR, CHATTISGARH	RAIPUR	CHHATTISGARH, 	Children,Education & Literacy,Health & Family Welfare,Labour & Employment,Micro Finance (SHGs),Micro Small & Medium Enterprises,Minority Issues,Nutrition,Panchayati Raj,Sports,Tribal Affairs,Urban Development & Poverty Alleviation,Vocational Training,Women's Development & Empowerment,Youth Affairs,Any Other,		
457	CG/2020/0253604	Globe Education And Development Society	lileshsahu.14@gmail.com	9752510215	Dharampura No.1 City Jagdalpur District Bastar State Chhattisgarh Pincode 492001	Jagdalpur	CHHATTISGARH, 			
458	CG/2018/0213469	GO GREEN WELFARE SOCIETY	gogreenwscg@gmail.com	7770847772	SERIKHEDI, SANDHYA POULTRY FARM, MAHASAMUND ROAD, RAIPUR CITY OFFICE -501 PITRA CHHAYA , PRIYADARSHANI NAGAR, RAIPUR-492001	RAIPUR	CHHATTISGARH, 	Panchayati Raj,Education & Literacy,Aged/Elderly,Environment & Forests,Human Rights,Information & Communication Technology,Nutrition,Sports,Women's Development & Empowerment,		
459	CG/2018/0203814	Godavari Innovative Training Institute	godavari1innovationtc@gmail.com	7906238863	Beside Nutan School, Near Manokamna Hanuman Mandir ,Yadav Mohalla,Tikrapara Raipur Chattisgarh	Raipur	BIHAR, 	Education & Literacy,Tourism,Vocational Training,		
460	CG/2018/0206449	Godriwala Education Society	mayurthourani@gmail.com	7509955555	MM SCHOOL, VILL: NAKTI, NAYA RAIPUR	RAIPUR	CHHATTISGARH, 	Education & Literacy,Science & Technology,Sports,	http://www.mmschool.ac.in	
461	CG/2020/0251375	Golden Feather Welfare Foundation	Goldenfeather115@gmail.com	9907340018	Junwani, Bhilai Teshil And Distt : Durg (C.G.)	Bhilai	CHHATTISGARH, 	Education & Literacy,Women's Development & Empowerment,		
462	CG/2016/0096991	GOLDEN FUTURE SEVA SAMITI kotra road Raigarh	goldensamiti@gmail.com	8878844077	Golden future seva samiti,Near gramin bank kotra road Raigarh chhattisgarh 496001	Raigarh	CHHATTISGARH, 	Animal Husbandry, Dairying  &  Fisheries,Aged/Elderly,Agriculture,Art & Culture,Biotechnology,Children,Civic Issues,Differently Abled,Disaster Management,Dalit Upliftment,Drinking Water,Education & Literacy,Environment & Forests,Food Processing,Health & Family Welfare,HIV/AIDS,Housing,Human Rights,Information & Communication Technology,Legal Awareness & Aid,Labour & Employment,Land Resources,Micro Finance (SHGs),Minority Issues,Micro Small & Medium Enterprises,	http://	
463	CG/2020/0267433	Good Hearts Society	ramkumar_kashyap@yahoo.co.in	9755634318	316 offizo , Magnatto Mall Raipur	Raipur		Agriculture,Children,Dalit Upliftment,Education & Literacy,Food Processing,Health & Family Welfare,Micro Finance (SHGs),Minority Issues,Women's Development & Empowerment,		
464	CG/2018/0187209	GOODSHEPHERD VILLAGE DEVELOPMENT SANSTHA	gsvdsbachelidantewada@gmail.com	9406001749	House of Blessings, Post- Bacheli Distt- Dantewada (C.G.)	BACHELI				
465	CG/2018/0199137	GOPAL AGRAWAL CHERITABLE SOCIETY	dineshrgh.ca@gmail.com	9826179425	MAL GODOWN ROAD, NEAR NIRMAL LODGE RAGARH (C.G.) 496001	RAIGARH	CHHATTISGARH, 	Education & Literacy,Health & Family Welfare,Rural Development & Poverty Alleviation,		
466	CG/2017/0177147	Gopala Finvest Limited	rajendra@rastoginursing.com	9300658100	PLOT NO. 3	Bhilai	CHHATTISGARH, 	Education & Literacy,		
467	CG/2017/0178968	GRACE SOCIAL DEVELOPMENT ORGANIZATION	gracesdo@rediffmail.com	9907016742	Borsi Bhatha, Near Akanksha Computer,Ward No. 50, Durg (C.G.)	Durg	CHHATTISGARH, 	Vocational Training,		
468	CG/2018/0210537	GRAM BHADI UPKAR SEWA SAMITI	xxxchauhan@gmail.com	9926616119	GRAM BHADIMAIN ROAD INFRONT OF BHANDI CHOWK	BAIKUNTHPUR				
469	CG/2020/0253061	Gram Kalyan Samiti Korea	gksk.org@gmail.com	9009150248	Near Joda Talab, Purani Basti, Manendragarh	Manendragarh	CHHATTISGARH, 	Agriculture,Children,Civic Issues,Dalit Upliftment,Education & Literacy,Environment & Forests,Legal Awareness & Aid,New & Renewable Energy,Right to Information & Advocacy,Rural Development & Poverty Alleviation,Sports,Women's Development & Empowerment,Animal Husbandry, Dairying  &  Fisheries,Art & Culture,Biotechnology,Differently Abled,Disaster Management,Drinking Water,Aged/Elderly,Food Processing,Health & Family Welfare,Housing,Human Rights,Information & Communication Technology,Labour & Employment,Land Resources,Micro Finance (SHGs),Micro Small & Medium Enterprises,Minority Issues,Nutrition,Panchayati Raj,Science & Technology,Scientific & Industrial Research,Tourism,Tribal Affairs,Urban Development & Poverty Alleviation,Vocational Training,Water Resources,		
470	CG/2017/0159653	GRAM MEDUKA KRISHI SHIKSHAN SMITI MEDUKA	coedu.meduka1@gmail.com	9826826111	VILLAGEMEDUKA, POST-DARRI, TASHIL- PENDRA ROAD	PENDRA ROAD				
471	CG/2017/0168700	GRAM MITRA SAMAJ SEWI SANSTHA	grammitracg@gmail.com	9424161505	Kadam Chauk, Near Town School Champa, Distt.- Janjgir Champa (C.G.) 459671	CHAMPA	CHHATTISGARH, 	Children,Education & Literacy,Environment & Forests,HIV/AIDS,Nutrition,Rural Development & Poverty Alleviation,Women's Development & Empowerment,Any Other,	http://www.grammitracg.org	
472	CG/2018/0200169	gram paryavaran vikas samiti	grampv2007@gmail.com	9589855555	near huns dev club janjgir chanpa	janjgir champa	CHHATTISGARH, 	Agriculture,Environment & Forests,Rural Development & Poverty Alleviation,Water Resources,Women's Development & Empowerment,		
473	CG/2017/0171929	GRAM VIKAS EVAM YUVA KALYAN SANSTHAN	gvyks_apur@rediffmail.com	9424250960	MISSION CHOWK WEST RING ROAD KEDARPUR, AMBIKAPUR DISTRICT SURGUJA (C.G.) 497001	AMBIKAPUR	CHHATTISGARH, 	Agriculture,Animal Husbandry, Dairying  &  Fisheries,Art & Culture,Biotechnology,Children,Civic Issues,Dalit Upliftment,Disaster Management,Drinking Water,Education & Literacy,Aged/Elderly,Environment & Forests,Food Processing,Health & Family Welfare,HIV/AIDS,Housing,Human Rights,Information & Communication Technology,Labour & Employment,Land Resources,Legal Awareness & Aid,Micro Finance (SHGs),Micro Small & Medium Enterprises,Minority Issues,New & Renewable Energy,Nutrition,Panchayati Raj,Right to Information & Advocacy,Rural Development & Poverty Alleviation,Tribal Affairs,Urban Development & Poverty Alleviation,Vocational Training,Water Resources,Women's Development & Empowerment,	http://www.gvyks.org	
474	CG/2013/0067007	GRAM VIKAS MANDLI ASSOCIATION TRUST MUNGELI	shamim.ngo@gmail.com	9977679628	GRAM VIKAS MANDLI ASSOCIATION TRUST BADA BAZAAR MUNGELI DIST MUNGELI	MUNGELI	CHHATTISGARH, 	Children,Civic Issues,Dalit Upliftment,Education & Literacy,Environment & Forests,Health & Family Welfare,Legal Awareness & Aid,Women's Development & Empowerment,		
475	CG/2016/0104344	GRAM VIKAS SAMITI	prabhakardwivedi1977@gmail.com	9826876912	Ward No. -3, Khopa Mahuwa, Ramanujganj,                                                     District-Balrampur- (CG)497001	Balrampur	CHHATTISGARH, 	Animal Husbandry, Dairying  &  Fisheries,Aged/Elderly,Agriculture,Art & Culture,Biotechnology,Children,Civic Issues,Differently Abled,Disaster Management,Dalit Upliftment,Drinking Water,Education & Literacy,Environment & Forests,Food Processing,Health & Family Welfare,HIV/AIDS,Housing,Human Rights,Information & Communication Technology,Legal Awareness & Aid,Labour & Employment,Land Resources,Micro Finance (SHGs),Minority Issues,Micro Small & Medium Enterprises,		
