S.no.	ID	Name	Email-id	Mobile no.	Address	City	State	Sector	Website
1091	CG/2018/0207243	Samarth Samrpan Seva Samiti	samarthsevasamiti@gmail.com	9399047330	K-6 ANUPAM NAGAR NR TV TOWER	RAIPUR	CHHATTISGARH, 	Agriculture,Children,Dalit Upliftment,Disaster Management,Drinking Water,Education & Literacy,Environment & Forests,Health & Family Welfare,Vocational Training,Animal Husbandry, Dairying  &  Fisheries,Art & Culture,Biotechnology,Civic Issues,Differently Abled,Aged/Elderly,Food Processing,HIV/AIDS,Housing,Human Rights,Information & Communication Technology,Labour & Employment,Land Resources,Legal Awareness & Aid,Micro Finance (SHGs),Micro Small & Medium Enterprises,Minority Issues,New & Renewable Energy,Nutrition,Panchayati Raj,Prisoner's Issues,Right to Information & Advocacy,Rural Development & Poverty Alleviation,Science & Technology,Scientific & Industrial Research,Sports,Tourism,Tribal Affairs,Urban Development & Poverty Alleviation,		
1092	CG/2019/0231264	Samay Lokhit Sewa Samiti	ssamaylokhit11@gmail.com	9981098720	Gali no. 3 Mamta Nagar Gulmohar Calony Ward17 Rajnandgaon 491441	Rajnandgaov	CHHATTISGARH, 	Education & Literacy,Health & Family Welfare,HIV/AIDS,Human Rights,		
1093	CG/2019/0236270	SAMHIT JAN KALYAN SAMITI CHARAMA	lalitanag8@gmail.com	9589279650	BAZAR PARA CHARAMA POST- CHARAMA TEH.-CHARAMA DISTT-KANKER	CHARAMA				
1094	CG/2017/0178995	SAMRIDHI EDUCATION AND WELFARE ASSOCIATIONS	rajesh53483@gmail.com	9827953483	SHAKUNTALA HEALTH CLINIC, KHARMORA ROAD PODIBAHAR KORBA	KORBA	CHHATTISGARH, 	Education & Literacy,		
1095	CG/2020/0255299	samridhi samaj sevi sansthan	toashwanisahu@gmail.com	9630748353	Vill Saristal P.O. Akhrar Block LormiDisrict Mungeli C.G.	Mungeli	CHHATTISGARH, 	Children,Animal Husbandry, Dairying  &  Fisheries,Art & Culture,Biotechnology,Civic Issues,Dalit Upliftment,Drinking Water,Education & Literacy,Aged/Elderly,Environment & Forests,Health & Family Welfare,HIV/AIDS,Human Rights,Labour & Employment,Legal Awareness & Aid,Micro Finance (SHGs),Panchayati Raj,Rural Development & Poverty Alleviation,Tribal Affairs,Urban Development & Poverty Alleviation,Vocational Training,Water Resources,Women's Development & Empowerment,Youth Affairs,		
1096	CG/2019/0233612	Samta Mahila Mandal 	tisamtasammandantewada@yahoo.in	9109537097	Samta Mahila Mandal HIG-13,Sector-1,shankar nagar,raipur chhattisgarh-492009	raipur	CHHATTISGARH, 			
1097	CG/2018/0206440	SAMTA MANCH	bhagvanmahaveersamta@gmail.com	9098838606	SAMTA MANCH JAIN MANDIR KE PICHE SADAR BAZAR, RAJNANDGAON	RAJNANDGAON	CHHATTISGARH, 	Drinking Water,Education & Literacy,		
1098	CG/2018/0183325	SAMTA YUVA SEWA SAMITI HATHKHOJ CHARODA BHILAI	vermarohan305@gmail.com	8253056803	WARD NO 1 GRAM POST HATHKHOJ TH CHARODA BHILAI DIST DURG PIN CODE 490024	BHILAI				
1099	CG/2017/0177873	SAMUDAYIK VIKAS SAMITI DHAMTARI	dalbhatbusstand@gmail.com	8982270443	new bus stand dhamtari	dhmatari			http:-www.ngodarpan.gov.in	
1100	CG/2019/0236169	Samvedna mansik viklang seva sanstha	samvedna.smh@gmail.com	9302090820	H. NO. 52/509, HOLY MOTHER SCHOOL COMPOUND, SUNDER NAGAR, RAIPUR (C.G)	RAIPUR	CHHATTISGARH, 	Animal Husbandry, Dairying  &  Fisheries,Education & Literacy,Environment & Forests,Health & Family Welfare,Human Rights,Minority Issues,Rural Development & Poverty Alleviation,Any Other,	http://www.samvedna.co.in	
1101	CG/2018/0200900	Samvedna Vikas Seva Samiti 	samvednavikas.chhattisgarh@gmail.com	9644234999	D.C.road ambikapur surguja chhattisgarh	ambikapur		HIV/AIDS,Labour & Employment,Rural Development & Poverty Alleviation,Vocational Training,		
1102	CG/2017/0176339	SAMYA BHOOMI FOUNDATION	samyabhoomifoundation@gmail.com	9455805453	Mailawada Kuakonda	Dantewada	CHHATTISGARH, 	Agriculture,Art & Culture,Children,Civic Issues,Differently Abled,Drinking Water,Education & Literacy,Environment & Forests,Food Processing,Health & Family Welfare,Human Rights,Legal Awareness & Aid,Nutrition,Panchayati Raj,Right to Information & Advocacy,Rural Development & Poverty Alleviation,Tribal Affairs,Vocational Training,Women's Development & Empowerment,Youth Affairs,		
1103	CG/2017/0152277	Sanabul Foundation	aftab.ahmed0007@gmail.com	9770475799	USMANIYA BADAGOL BAZAR DHAMTARI C.G.	DHAMTARI	CHHATTISGARH, 	Education & Literacy,Labour & Employment,Rural Development & Poverty Alleviation,Urban Development & Poverty Alleviation,Vocational Training,		
1104	CG/2018/0207081	SANATAN SANT SAMAJ GAHIRA	secretary13379@gmail.com	9926356881	VILLAGE-SAMARBAR, POST-DURGAPARA	BAGICHA	CHHATTISGARH, 	Tribal Affairs,		
1105	CG/2016/0113106	SANCHAY EDUCATION SOCIETY	sanchays.education@gmail.com	9229208352	D-12, ANUPAM NAGAR, NEAR GANESH TEMPLE,RAIPUR -492001	RAIPUR	CHHATTISGARH, 	Education & Literacy,Children,Health & Family Welfare,Labour & Employment,Women's Development & Empowerment,Rural Development & Poverty Alleviation,	http://sanchayeducation.in	
1106	CG/2017/0119335	SANCHAY SAMAJ SEVI SANSTHA	sanchay004@gmail.com	9827196457	1. VILL. BHULSIDIH PO. RISDI DIST. KORBA PINCODE 495683. RP. NAGAR PHASE 1 IN FRONT OF DUSSHERA MAIDAN, NIHARIKA KORBA PINCODE 495677	KORBA	CHHATTISGARH, 	Agriculture,Environment & Forests,Health & Family Welfare,Housing,Information & Communication Technology,New & Renewable Energy,Rural Development & Poverty Alleviation,Urban Development & Poverty Alleviation,Vocational Training,Women's Development & Empowerment,Any Other,		
1107	CG/2019/0241107	SANDESH MAHILA SWA SAHAYTA SAMOOH	sandeshmsssrpr@gmail.com	7024788391	C/O MR NAGENDRA SHAH, ADARSH NAGAR, BIP BASTI, METAL PARK, BEERGAON, DISTT RAIPUR CG	RAIPUR	CHHATTISGARH, 	Agriculture,Animal Husbandry, Dairying  &  Fisheries,Art & Culture,Children,Dalit Upliftment,Drinking Water,Education & Literacy,Aged/Elderly,Environment & Forests,Food Processing,Health & Family Welfare,Housing,Labour & Employment,Legal Awareness & Aid,Minority Issues,Tourism,Vocational Training,Women's Development & Empowerment,		
1108	CG/2020/0268445	sandesh samajik sanstha	sandeshsamajiks@gmail.com	8319282927	Mahadevghat Road, D.D Nagar Infront of Police Station, Prakhar Book Depo Rapur	Raipur	CHHATTISGARH, 	Agriculture,Animal Husbandry, Dairying  &  Fisheries,Children,Education & Literacy,Women's Development & Empowerment,		
1109	CG/2019/0230908	Sandesh Welfair &Rural Devlopment Society	sandeshwelfairsociety@gmail.com	8839002239	Plot Number 185 Ward Number 40 Indra Nagar Near Pani Tanky Rajnandgaon Chhattisgarh 491441	Rajnandgaon	CHHATTISGARH, 	Agriculture,Children,Drinking Water,Education & Literacy,		
1110	CG/2019/0236909	SANDIPANI ACADEMY	SANDIPANI.ACHHOTI@GMAIL.COM	9926878174	LIG-148,SECTOR-02,NEAR WATER TANK, PT. DINDAYAL UPADHYA NAGAR,RAIPUR	RAIPUR	CHHATTISGARH, 	Education & Literacy,Health & Family Welfare,Vocational Training,Agriculture,Information & Communication Technology,Science & Technology,	http://www.sandipanigroup.org	
1111	CG/2017/0120247	SANG CHALO SANGWARI MANN SEWA SAMITI	sangchalosangwariman@gmail.com	9303810050	492001		CHHATTISGARH, 	Education & Literacy,Health & Family Welfare,Panchayati Raj,Sports,Tribal Affairs,Vocational Training,Women's Development & Empowerment,Youth Affairs,		
1112	CG/2019/0234497	SANGAM NATYA SAMITI	sangamnatyasamiti@gmail.com	7089121823	R NO 07 ATAL AWAS NEAR BAGDAI MATA MANDIR ASHOK NAGAR WARD NO 58	BILASPUR	CHHATTISGARH, MADHYA PRADESH, CHHATTISGARH, MADHYA PRADESH, CHHATTISGARH, DELHI, MADHYA PRADESH, CHHATTISGARH, MADHYA PRADESH, 	Art & Culture,Children,Education & Literacy,Agriculture,Dalit Upliftment,Drinking Water,Environment & Forests,Tribal Affairs,Human Rights,Women's Development & Empowerment,		
1113	CG/2017/0179571	Sangam Sewa Samiti Bhadesar	tarkeshwarsrc@gmail.com	9826699884	C/oShri Ram Computer,Infront of Madhaw Lodge	Janjgir	CHHATTISGARH, 	Agriculture,Education & Literacy,Health & Family Welfare,Micro Finance (SHGs),Water Resources,Women's Development & Empowerment,Food Processing,		
1114	CG/2009/0006860	Sangata Sahabhagi Gramin Vikas Sansthan	sangata2003b@yahoo.co.in	9826185319	Working Office: Bhagwanpur Ward No.1 , Behind Rawat ResidencyAmbikapur497001	Ambikapur	CHHATTISGARH, 	Animal Husbandry, Dairying  &  Fisheries,Aged/Elderly,Agriculture,Children,Differently Abled,Dalit Upliftment,Drinking Water,Education & Literacy,Environment & Forests,Health & Family Welfare,HIV/AIDS,Human Rights,Legal Awareness & Aid,Land Resources,Micro Finance (SHGs),Micro Small & Medium Enterprises,New & Renewable Energy,Nutrition,Panchayati Raj,Tribal Affairs,Vocational Training,Water Resources,Women's Development & Empowerment,Youth Affairs,	http://sangata.org	
1115	CG/2019/0245733	SANGI MITAN SEWA SANSTHAN	mamta.sharma5188@gmail.com	9993075188	33-34/A SECTOR 1 BAJAJ COLONY NEW RAJENDRA NAGAR	Raipur	CHHATTISGARH, 	Agriculture,Art & Culture,Children,Civic Issues,Differently Abled,Education & Literacy,Aged/Elderly,Health & Family Welfare,Human Rights,Prisoner's Issues,Vocational Training,Women's Development & Empowerment,		
1116	CG/2017/0161131	SANJAR EDUCATION SOCEITY	mohammedashfaque786@gmail.com	8357869786	NEAR MASJID, OPP. GOVT. SCHOOL, SANTOSHI NAGAR	RAIPUR	CHHATTISGARH, 	Children,		
1117	CG/2021/0272206	SANJAREE EDUCATION SOCIETY	ISHRATASHRAFI.7860@GMAIL.COM	8085659621	Ward no 39 diprapar durg	durg				
1118	CG/2017/0173526	Sanjeevan Foundation	sf.ddugky@gmail.com	9300550100	RASTOGI COMPLEX ,31,COMMERCIAL COMPLEX, M. L. NEHRU NAGAR (EAST), BHILAI	Bhilai	CHHATTISGARH, 	Education & Literacy,		
1119	CG/2017/0166001	Sanjeevani Welfare Association	john_kor@rediffmail.com	9479036772	Near Mahak Almirah Factory, Karan Nagar,New Changorabhata, Raipur	Raipur	CHHATTISGARH, 	Women's Development & Empowerment,Animal Husbandry, Dairying  &  Fisheries,New & Renewable Energy,		
1120	CG/2018/0188876	SANJIVANI GRAMIN VIKAS SANSTHA CHHATTISGARH	sanjivani_bastar@rediffmail.com	7089090063	472 DindayalHousing Board ManglaBilaspur	bilaspur	CHHATTISGARH, 	Children,Dalit Upliftment,Education & Literacy,HIV/AIDS,Micro Small & Medium Enterprises,Rural Development & Poverty Alleviation,Tribal Affairs,Urban Development & Poverty Alleviation,Vocational Training,Women's Development & Empowerment,		
1121	CG/2017/0116482	SANKALP EK PRAYAS	parimal.india@gmail.com	9425553681	SANKALP EK PRAYAS SOCIETY, BHILAI  ROOM NO-3, CONTRACTOR BUILDING, NSPCL TOWNSHIP,BHILAI-490006	Bhilai	CHHATTISGARH, 	Education & Literacy,	http://www.sankalpekprayas.org	
1122	CG/2010/0030957	Sankalp Sanskritik Samiti	sankalpss1@rediffmail.com	9827179103	18, Kailash Residency, Shankar Nagar, Raipur - 492001, Chhattisgarh	Raipur	CHHATTISGARH, 	Art & Culture,Children,Drinking Water,Education & Literacy,Environment & Forests,Health & Family Welfare,HIV/AIDS,Labour & Employment,Micro Finance (SHGs),Minority Issues,Nutrition,Panchayati Raj,Rural Development & Poverty Alleviation,Science & Technology,Tribal Affairs,Urban Development & Poverty Alleviation,Vocational Training,Water Resources,Women's Development & Empowerment,Youth Affairs,	http://sankalpss.org	
1123	CG/2017/0118886	Sankalp Sewa Evam Shiksham Samiti	vandemataramcollege@gmail.com	9424203501	Sankalp Sewa Evam Shikshan Samiti, C/O Vandemataram College, Ganesh Chowk, Dhamtari (C.G.) Pin-493773	Dhamtari	CHHATTISGARH, 	Education & Literacy,		
1124	CG/2019/0236176	Sankalpit Sewa Sansthan	sandipsankalp@rediffmail.com	9425227054	Sankalp Eye Hospital , Magneto Mall Road, Shrikant Verma Marg,	Bilaspur				
1125	CG/2017/0118538	SANMARG SHIKSHA SAMITI SURGUJA	sanmargss@gmail.com	9926179478	THANAROAD, MAYAPUR, CHANDANI CHOWK, AMBIKAPUR 497001	AMBIKAPUR	CHHATTISGARH, 	Children,Education & Literacy,Human Rights,Rural Development & Poverty Alleviation,Women's Development & Empowerment,	https://sanmargss.weebly.com/	
1126	CG/2017/0175429	Sansakar Gramin Seva Avam Manav Kalyan Samiti	sanskarngo567@gmail.com	7440942119	Manokamna Main Road Bishrampur, disst-surajpur, chhatisgarh, 497226	Surajpur	CHHATTISGARH, 	Education & Literacy,Health & Family Welfare,Human Rights,Labour & Employment,Micro Finance (SHGs),Nutrition,Right to Information & Advocacy,Rural Development & Poverty Alleviation,Science & Technology,Tribal Affairs,Vocational Training,Women's Development & Empowerment,Agriculture,Animal Husbandry, Dairying  &  Fisheries,Art & Culture,Biotechnology,Children,Dalit Upliftment,Differently Abled,Disaster Management,Drinking Water,Aged/Elderly,Environment & Forests,Food Processing,HIV/AIDS,Housing,Information & Communication Technology,Land Resources,Legal Awareness & Aid,Micro Small & Medium Enterprises,Minority Issues,New & Renewable Energy,Panchayati Raj,Urban Development & Poverty Alleviation,Water Resources,		
1127	CG/2010/0037139	sanskar gyan peeth shikshan samiti	sureshsoni36@gmail.com	9406249187	sanskar gyan peeth shikshan samiti  bajpayee bhawan, behind old RTO office nehru nagar road bilapsur (c.g.)  pin code-495001	Bilapsur		Animal Husbandry, Dairying  &  Fisheries,Aged/Elderly,Agriculture,Art & Culture,Biotechnology,Children,Civic Issues,Differently Abled,Disaster Management,Dalit Upliftment,Drinking Water,Education & Literacy,Environment & Forests,Food Processing,Health & Family Welfare,HIV/AIDS,Housing,Human Rights,Information & Communication Technology,Legal Awareness & Aid,Labour & Employment,Land Resources,Micro Finance (SHGs),Minority Issues,Micro Small & Medium Enterprises,		
1128	CG/2019/0247813	SANSKAR SEVA SAMITI	yogeshtiwari305@gmail.com	9098820194	iNDUBALA GAJPAL RESIDENCE GAJPAL SADAN SHRADDHA NAGAR AAMAPARA ROAD DHAMATARI	NAYA RAIPUR	CHHATTISGARH, 	Civic Issues,Disaster Management,Education & Literacy,Health & Family Welfare,Vocational Training,		
1129	CG/2020/0267355	SANSKRITI FOUNDATION	vishwavijay16@gmail.com	7000493340	Darripara Ambikapur	Ambikapur	CHHATTISGARH, 	Children,Civic Issues,Education & Literacy,Aged/Elderly,Environment & Forests,Sports,Tribal Affairs,Agriculture,Animal Husbandry, Dairying  &  Fisheries,Art & Culture,Biotechnology,Dalit Upliftment,Differently Abled,Disaster Management,Drinking Water,Health & Family Welfare,Human Rights,Labour & Employment,Micro Small & Medium Enterprises,Minority Issues,Nutrition,Right to Information & Advocacy,Rural Development & Poverty Alleviation,Tourism,Urban Development & Poverty Alleviation,Vocational Training,Water Resources,Women's Development & Empowerment,Youth Affairs,HIV/AIDS,New & Renewable Energy,		
1130	CG/2016/0110689	SANSKRITI SIKSHA SAMITI	kabirdhamiti@gmail.com	9993244967	H. NO. 95 P.S. CITY CHANGORABHATA  RING RAOD NO.01  RAIPUR  492001	RAIPUR	CHHATTISGARH, 	Agriculture,Education & Literacy,Health & Family Welfare,HIV/AIDS,Information & Communication Technology,New & Renewable Energy,Nutrition,Panchayati Raj,Tribal Affairs,Vocational Training,Women's Development & Empowerment,Any Other,		
1131	CG/2019/0233065	SANSKRITIMAHILASAMITI	suny.msmd@gmail.com	7771885000	WAD NO.21, VAISHALI VILLA ADARSHA NAGAR MAHASAMUND C.G. 493445	MAHASAMUND 	CHHATTISGARH, 	Children,Civic Issues,Differently Abled,Environment & Forests,Health & Family Welfare,Nutrition,Rural Development & Poverty Alleviation,Women's Development & Empowerment,Any Other,		
1132	CG/2017/0152024	SANT NAMDEO AROGYA SEVA SAMITI BHILAI CHHATTISGARH	dr.pramodnp@gmail.com	9827150419	64, GANDHI NAGAR,DIXIT COLONY, NEHRU NAGAR WARD NO-3, BHILAI.	BHILAI	CHHATTISGARH, 	Health & Family Welfare,		
1133	CG/2019/0239437	SANT SIYA BHUWNESHWARI SHARAN JI VYAS GAUSHALA EVAM SEWA SANSTHAN	santsiya.bhuneshwari2019@gmail.com	9165681110	Village-Sirkutti Kutena Post-Pandula Tch-Chura Dist-Gariyabandh	Gariyabandh	CHHATTISGARH, 	Education & Literacy,Labour & Employment,Nutrition,Panchayati Raj,Tribal Affairs,Vocational Training,Women's Development & Empowerment,Youth Affairs,		
1134	CG/2018/0194182	sara samaj sewi sanstha	sarasamajss@gmail.com	8085831065	Renjarpara saranggarhdistt raigarh	saranggarh	CHHATTISGARH, 	Agriculture,Environment & Forests,HIV/AIDS,Water Resources,Women's Development & Empowerment,		
1135	CG/2020/0262010	SARASWATI BAL KALYAN SAMITI MASTURI	ssm.masturi@gmail.com	7415564642	Near Bus Stand Masturi Village And Post Masturi Distt. Bilaspur C.G 495551	Bilaspur	CHHATTISGARH, 	Education & Literacy,		
1136	CG/2018/0199155	SARASWATI BAL KALYAN SAMITY TAKHATPUR	sharmajanak727@gmail.com	9893355148	Takhatpur Bilaspur Chhattisgarh	Takhatpur	CHHATTISGARH, 	Education & Literacy,		
1137	CG/2018/0200496	SARASWATI GRAMIN SHIKSHA SAMITI LAL BAHADUR NAGAR   	MUKESH14114@GMAIL.COM	9691407810	Shri Saraswati Shishu Mandir Village Post Lal Bahadur Nagar Block Dongargarh District Rajnandgaon Chhattisgarh 491445	Raipur	CHHATTISGARH, 	Education & Literacy,		
1138	CG/2017/0155248	SARASWATI KRIDA PARISAD CHHATTISGARH	dswarn5@gmail.com	7225020567	SARASWATI KRIDA PARISAD CHHATTISGARH, SARASWATI VIHAR, KHEL PARISAR, SENDRI,	BILASPUR	CHHATTISGARH, 	Sports,		
1139	CG/2020/0265409	Saraswati Sadbhawna Mahila Mandal	saraswatismmjgp@gmail.com	9303883344	C/O MRS PRAMILA KAPOOR, MOTI TALAB PARA, JAGDALPUR, DISTT. BASTAR	RAIPUR	CHHATTISGARH, 	Agriculture,Animal Husbandry, Dairying  &  Fisheries,Art & Culture,Biotechnology,Children,Civic Issues,Dalit Upliftment,Differently Abled,Disaster Management,Drinking Water,Education & Literacy,Aged/Elderly,Environment & Forests,Food Processing,Health & Family Welfare,HIV/AIDS,Housing,Human Rights,Information & Communication Technology,Labour & Employment,Land Resources,Legal Awareness & Aid,Micro Finance (SHGs),Micro Small & Medium Enterprises,Minority Issues,New & Renewable Energy,Nutrition,Panchayati Raj,Prisoner's Issues,Right to Information & Advocacy,Rural Development & Poverty Alleviation,Science & Technology,Scientific & Industrial Research,Sports,Tourism,Tribal Affairs,Urban Development & Poverty Alleviation,Vocational Training,Water Resources,Women's Development & Empowerment,Youth Affairs,Any Other,		
1140	CG/2018/0187086	SARASWATI SHIKSHA SAMITI CHHURIA	kksahulbnagar@gmail.com	9425577878	WARD NO. 14 KHUNTA CHHURIA,NAGAR PANCHAYAT CHHURIA	CHHURIA	CHHATTISGARH, 	Children,Drinking Water,Education & Literacy,Any Other,		
1141	CG/2017/0155219	SARASWATI SHIKSHA SAMITI DONGARGARH	pyadavssm@gmail.com	9407711765	NEAR GOVT GIRLS SCHOOL NAKAPARA DONGARGARH	DONGARGARH				
1142	CG/2018/0208675	SARASWATI SHIKSHA SAMITI KATGHORA	sssktg18@gmail.com	8085618013	KARKHAN AREA KATGHORA	KATGHORA				
1143	CG/2017/0177961	SARASWATI SHIKSHA SAMITI MANPUR	dspurame@gmail.com	9516368125	VILL POST TAH MANPUR	MANPUR				
1144	CG/2018/0206638	SARASWATI SHIKSHA SANSTHAN	sahu.kishor8470@gmail.com	9425597051	RAIPUR	RAIPUR 				
1145	CG/2019/0225005	SARASWATI SHISHU MANDIR	ravichakraborty320@gmail.com	9424259826	SARASWATI SHISHU MANDIR WEST CHIRIMIRI CHITTAJHOR PONDI DISTT KORIYA C.G.	CHIRIMIRI	CHHATTISGARH, 	Children,Education & Literacy,Education & Literacy,		
1146	CG/2017/0168361	Sarguja Gramin Vikas Sansthan	sgvs.sarguja1991@gmail.com	9977421214	Village- Rajkheta, Post	Wadrafnagar	CHHATTISGARH, 	Water Resources,		
1147	CG/2017/0162004	Saroj Gopal Educational Society	rkgupta30@hotmail.com	9425235203	Mahkakurd, Utai-Ganayari Road, Durg, Chhattisgarh	Bhilai	CHHATTISGARH, 	Education & Literacy,Vocational Training,	http://www.prismschool.ac.in	
1148	CG/2017/0171615	Sarojnandan Shiksha Vikas Samiti	sap_mishra@hotmail.com	9893296367	Street-1, Mahamaya Vihar, Ware House Road	Bilaspur				
1149	CG/2018/0193999	sarokar seva sanstha	sarokarsewa@gmail.com	9713338462	IN FORANT OF SBI AMBIKAPUR ROAD KATGHORA	KORBA	CHHATTISGARH, 	Education & Literacy,Environment & Forests,Health & Family Welfare,Labour & Employment,Legal Awareness & Aid,Panchayati Raj,Right to Information & Advocacy,Rural Development & Poverty Alleviation,Science & Technology,Tribal Affairs,Urban Development & Poverty Alleviation,Vocational Training,Women's Development & Empowerment,Any Other,		
1150	CG/2018/0191819	SARSWATI GRAM SHIKCHHA SAMITI CHARBHATHA	girvarsahu2018@gmail.com	7898351638	Village Post Charbhata Tahsil Dongargarh District Rajnandgaon Chhattisgarh 491557	RAIPUR	CHHATTISGARH, 	Education & Literacy,Environment & Forests,Sports,Women's Development & Empowerment,		
1151	CG/2017/0154924	SARSWATI GRAM SHIKSHA SAMITI CHHATTISGARH	grambharticg@gmail.com	7869107709	sarswati vihar, khel parisar, behindi eng. collage, malavan sendri (koni), dist-bilaspur,pin-4	BILASPUR	CHHATTISGARH, 	Education & Literacy,		
1152	CG/2020/0265366	SARSWATI SHISHU BAL KALYAN SAMITI KARGI ROAD KOTA	hrpuri143@gmail.com	8871916648	at post kargi road, tehsil kargi road, district bilaspur (c.g.)	kargi road	CHHATTISGARH, 	Education & Literacy,		
1153	CG/2019/0236937	SARTHAK FOUNDATION DONGARGARH	sarthakfoundationdgg@gmail.com	9907841592	C/O KAMESHWAR PRASAD SAHU H/N 277 WARD NO 6 CHHIRPANI SHIV MANDIR KE PASS DONGARGARH	DONGARGARH	CHHATTISGARH, 	Agriculture,Art & Culture,Children,Drinking Water,Education & Literacy,Aged/Elderly,Environment & Forests,Health & Family Welfare,Human Rights,Information & Communication Technology,Labour & Employment,Micro Small & Medium Enterprises,Nutrition,Rural Development & Poverty Alleviation,Tribal Affairs,Urban Development & Poverty Alleviation,Vocational Training,Water Resources,Women's Development & Empowerment,Any Other,		
1154	CG/2018/0199425	sarthak jan vikash sansthan	sarthakcg@rediffmail.com	9826131864	sarthak jan vikash sansthan, kedarpur joda pipal,maharaja gali Ambikapur, District- Chhattisgarh, Ambikapur	Ambikapur	CHHATTISGARH, 	Children,	https://sarthakcg.org/	
1155	CG/2018/0209905	sarthak paryas mahila swa sahayta samuh  durg 	jwalaexpress@gmail.com	9685253551	WARD NO 27 JHUELELAL MANDIR K PICHESINDHI COLONYDURG CHHATISGARH	DURG				
1156	CG/2019/0242031	Sarv Shiksha Avam Social Welfare Foundation Chhattisgarh	Sarvshiksha2016@gmail.com	9009270796	302 Ward 08 Gram Post Mudpar Teshil Palari Distt Raipur	Mudpar	CHHATTISGARH, 	Education & Literacy,Health & Family Welfare,Rural Development & Poverty Alleviation,Women's Development & Empowerment,		
1157	CG/2019/0239720	SARVA SAMADHAN EDUCATIONAL AND WELFEARE SOCIETY	chandrakartarachand@gmail.com	9752985888	MIG-2 QR. NO. 4 MINAKSHI NAGAR BORSI DURG 491001	DURG	CHHATTISGARH, 	Agriculture,Animal Husbandry, Dairying  &  Fisheries,Art & Culture,Children,Civic Issues,Education & Literacy,Aged/Elderly,Environment & Forests,Health & Family Welfare,HIV/AIDS,Labour & Employment,Micro Finance (SHGs),Prisoner's Issues,Rural Development & Poverty Alleviation,Urban Development & Poverty Alleviation,Vocational Training,Women's Development & Empowerment,Youth Affairs,Food Processing,Legal Awareness & Aid,Minority Issues,Nutrition,Science & Technology,Sports,Tribal Affairs,Urban Development & Poverty Alleviation,		
1158	CG/2017/0152663	SARVAJANIK VIKAS VAHINI SAMITI	vir83_jaiswal@rediffmail.com	9300151234	Sarvajanik vikas vahini , sangam chowk , tiwari colony ,jashpurnagar	Jashpur	CHHATTISGARH, 	Children,Health & Family Welfare,Human Rights,Rural Development & Poverty Alleviation,Women's Development & Empowerment,	https://ngodarpan.gov.in/index.php/ngo/primaryngo	
1159	CG/2019/0228434	Sarvhitam Educational and Social Welfare Society	vk9852018533@gmail.com	9111111982	KBT/99, Kabir Nagar, Phase -3, Nagar Nigam Zone-8, Raipur	RAIPUR	CHHATTISGARH, 	Children,Differently Abled,Education & Literacy,Aged/Elderly,Environment & Forests,Health & Family Welfare,HIV/AIDS,Micro Finance (SHGs),Urban Development & Poverty Alleviation,Vocational Training,Women's Development & Empowerment,		
1160	CG/2018/0183485	Sarvkalyan Samiti	manjitrecordiest@gmail.com	8871755155	Smt. Baljit Kaur Ji ka Makan Near Jyoti English Medium School G.E. Road, BMY, Charoda	Bhilai Charoda	CHHATTISGARH, 	Vocational Training,	http://www.sarvkalyan.co.in	
1161	CG/2019/0247950	SARVUDAY JAN SEWA SAMITI DURG	sbalwant666@gmail.com	7828487810	H.NO.40, WARD NO.05, BEHIND GURUDWARA, BHEEM NAGAR,SUPELA, BHILAI, DURG	BHILAI	CHHATTISGARH, 	Children,Dalit Upliftment,Drinking Water,Education & Literacy,Health & Family Welfare,HIV/AIDS,Labour & Employment,Legal Awareness & Aid,Panchayati Raj,Rural Development & Poverty Alleviation,Tribal Affairs,Urban Development & Poverty Alleviation,Vocational Training,Women's Development & Empowerment,Youth Affairs,		
1162	CG/2018/0185075	SARWADA SHRIJAN SHIKSHAN EVAM SEVA SANSTHAN	ssrijan827@gmail.com	9131260305	HEAD OFFICE VILLAGE LOHARSING POST KONDATARAI IN FRANT OF MAA MANGALA COLLAGE PARISAR RAIGARH 496100 CHHATTISGARH	RAIGARH	CHHATTISGARH, 	Rural Development & Poverty Alleviation,Rural Development & Poverty Alleviation,		
1163	CG/2016/0101893	sarwangin vikas mahila mandal	svmmbsp@gmail.com	9479111879	C/O ANKIT VIDHYA MANDIR NEW SARKANDAJABRAPARA	BILASPUR		Health & Family Welfare,Rural Development & Poverty Alleviation,Vocational Training,Women's Development & Empowerment,		
1164	CG/2017/0152495	Satat Pragti Jankalyan Samajik Sanstha	dewanganraghu29@gmail.com	9827988059	c/o MP Tailor, Durga Chowk, Near Baspai Para Rajnandgaon Pin no. 491441	Rajnandgaon				
1165	CG/2019/0235728	SATNAM YUVA WING JANKALYAN SAMITI	dahariyag0786@gmail.com	7447000097	Plot No. 18/7, First Floor, Dakshin Gangotri, Supela bhilai, Dist-Durg	Durg	CHHATTISGARH, 	Agriculture,Animal Husbandry, Dairying  &  Fisheries,Art & Culture,Biotechnology,Children,Civic Issues,Dalit Upliftment,Differently Abled,Disaster Management,Drinking Water,Education & Literacy,Aged/Elderly,Environment & Forests,Food Processing,Health & Family Welfare,HIV/AIDS,Housing,Human Rights,Labour & Employment,Nutrition,Right to Information & Advocacy,Science & Technology,Tourism,Tribal Affairs,Urban Development & Poverty Alleviation,Vocational Training,Women's Development & Empowerment,Youth Affairs,		
